{
  "envelope_version": 1,
  "event_id": "5d2f1c9e-6a04-4f2b-8f0c-2ad9e1f4b7c3",
  "event_type": "pickup.fact.handover_completed",
  "event_version": 1,
  "occurred_at": "2026-09-04T15:30:00.000Z",
  "published_at": "2026-09-04T15:30:01.250Z",
  "producer": "pickup",
  "message_kind": "integration",
  "aggregate_scope": "aggregate",
  "aggregate_type": "pickup_task",
  "aggregate_id": "f2faafa9-bca5-491f-b4b6-ef3b9884206c",
  "aggregate_version": 4,
  "correlation_id": "3a7e43e5-0014-4a89-abe5-5e927cf3a3e9",
  "causation_id": "6ba7b810-9dad-11d1-80b4-00c04fd430c8",
  "traceparent": "00-4bf92f3577b34da6a3ce929d0e0e4736-00f067aa0ba902b7-01",
  "tenant_id": "3fa85f64-5717-4562-b3fc-2c963f66afa6",
  "data_classification": "internal",
  "pii_present": false,
  "schema_uri": "https://hudhud.platform/contracts/events/pickup.fact.handover_completed/v1.schema.json",
  "payload": {
    "pickup_task_id": "f2faafa9-bca5-491f-b4b6-ef3b9884206c",
    "shipment_id": "835aa643-3538-4cb1-ae26-9beb65224618",
    "handover_manifest_id": "9c1f0b52-4c3a-4a0e-9c1e-8f2a6d5b4e10",
    "receiving_hub_id": "6f9c1d23-0b55-4f9a-9d67-1c4e5a8b2d31",
    "outcome": "RECEIVED",
    "released_at": "2026-09-04T15:30:00.000Z",
    "releasing_driver_user_id": "driver-42",
    "receiving_actor_id": "hub-operator-7"
  },
  "metadata": {
    "replay": false
  }
}
