{
  "envelope_version": 1,
  "event_id": "24b4c3ce-b1e6-5e0b-be80-76918289d929",
  "event_type": "legacy_bridge.observation.shipment_timeline_entry",
  "event_version": 1,
  "occurred_at": "2026-08-30T11:15:42.456Z",
  "producer": "legacy_bridge",
  "message_kind": "integration",
  "aggregate_scope": "non_aggregate",
  "correlation_id": "f47ac10b-58cc-4372-a567-0e02b2c3d479",
  "data_classification": "internal",
  "pii_present": false,
  "payload": {
    "source_table": "shipment_events",
    "source_pk": "2f9b2c8e-1a3d-4e5f-9b8c-7d6e5f4a3b2c",
    "source_position": "2026-08-30T11:15:42.456Z|2f9b2c8e-1a3d-4e5f-9b8c-7d6e5f4a3b2c",
    "source_module": "shipment",
    "legacy_event_type": "SHIPMENT_CREATED",
    "occurred_at": "2026-08-30T11:15:42.456Z",
    "shipment_id": "a1b2c3d4-e5f6-7890-abcd-ef1234567890",
    "bridge_mapper_version": "1.0.0"
  }
}
