{
  "envelope_version": 1,
  "event_id": "8690322c-6c87-5fef-99f2-4a04999f790e",
  "event_type": "legacy_bridge.observation.audit_entry",
  "event_version": 1,
  "occurred_at": "2026-08-30T14:32:01.123Z",
  "producer": "legacy_bridge",
  "message_kind": "integration",
  "aggregate_scope": "non_aggregate",
  "correlation_id": "6ba7b810-9dad-11d1-80b4-00c04fd430c8",
  "data_classification": "confidential",
  "pii_present": true,
  "payload": {
    "source_table": "audit_logs",
    "source_pk": "8d2e1f0a-9b8c-7d6e-5f4a-3b2c1d0e9f8a",
    "source_position": "0/16B3A8D8",
    "source_module": "auth",
    "audit_entry_id": "8d2e1f0a-9b8c-7d6e-5f4a-3b2c1d0e9f8a",
    "action": "USER_LOGIN",
    "entity_type": "user",
    "entity_id": "c0ffee00-0000-4000-8000-000000000001",
    "actor_type": "user",
    "actor_id": "c0ffee00-0000-4000-8000-000000000001",
    "source": "auth",
    "occurred_at": "2026-08-30T14:32:01.123Z",
    "metadata": {
      "ip_address": "[REDACTED]",
      "user_agent": "[REDACTED]"
    },
    "bridge_mapper_version": "1.0.0"
  },
  "metadata": {
    "replay": false
  }
}
