{
  "envelope_version": 1,
  "event_id": "550e8400-e29b-41d4-a716-446655440000",
  "event_type": "platform.notification.config_changed",
  "event_version": 1,
  "occurred_at": "2026-08-30T14:32:01.123Z",
  "producer": "notification",
  "message_kind": "projection",
  "aggregate_scope": "non_aggregate",
  "correlation_id": "6ba7b810-9dad-11d1-80b4-00c04fd430c8",
  "data_classification": "public",
  "pii_present": false,
  "payload": {
    "config_key": "push_retry_backoff_seconds",
    "new_value": 30
  },
  "metadata": {
    "actor_type": "system"
  }
}
