{
  "envelope_version": 1,
  "event_id": "7c9e6679-7425-40de-944b-e07fc1f90ae7",
  "event_type": "pickup.fact.accepted",
  "event_version": 1,
  "occurred_at": "2026-08-30T11:15:42.456Z",
  "producer": "pickup",
  "message_kind": "integration",
  "aggregate_scope": "aggregate",
  "aggregate_type": "shipment",
  "aggregate_id": "a1b2c3d4-e5f6-7890-abcd-ef1234567890",
  "aggregate_version": 4,
  "correlation_id": "f47ac10b-58cc-4372-a567-0e02b2c3d479",
  "causation_id": "6ba7b810-9dad-11d1-80b4-00c04fd430c8",
  "traceparent": "00-4bf92f3577b34da6a3ce929d0e0e4736-00f067aa0ba902b7-01",
  "tenant_id": "3fa85f64-5717-4562-b3fc-2c963f66afa6",
  "data_classification": "internal",
  "pii_present": false,
  "payload": {
    "pickup_task_id": "2f9b2c8e-1a3d-4e5f-9b8c-7d6e5f4a3b2c",
    "hub_id": "8d2e1f0a-9b8c-7d6e-5f4a-3b2c1d0e9f8a",
    "scan_method": "qr"
  },
  "metadata": {
    "actor_type": "user",
    "actor_id": "c0ffee00-0000-4000-8000-000000000001",
    "replay": false
  },
  "media_refs": [
    {
      "ref_type": "s3",
      "bucket": "hudhud-evidence",
      "key": "pickup/2026/08/30/proof.jpg",
      "content_type": "image/jpeg"
    }
  ]
}
