{
  "envelope_version": 1,
  "event_id": "a1eb92fb-3f7d-4a8c-be2e-bcc8979ae574",
  "event_type": "pickup.fact.accepted",
  "event_version": 1,
  "occurred_at": "2026-09-04T12:00:00.000Z",
  "published_at": "2026-09-04T12:00:01.100Z",
  "producer": "pickup",
  "message_kind": "integration",
  "aggregate_scope": "aggregate",
  "aggregate_type": "pickup_task",
  "aggregate_id": "f2faafa9-bca5-491f-b4b6-ef3b9884206c",
  "aggregate_version": 3,
  "correlation_id": "3a7e43e5-0014-4a89-abe5-5e927cf3a3e9",
  "causation_id": "6ba7b810-9dad-11d1-80b4-00c04fd430c8",
  "traceparent": "00-4bf92f3577b34da6a3ce929d0e0e4736-00f067aa0ba902b7-01",
  "tenant_id": "3fa85f64-5717-4562-b3fc-2c963f66afa6",
  "data_classification": "internal",
  "pii_present": false,
  "schema_uri": "https://hudhud.platform/contracts/events/pickup.fact.accepted/v1.schema.json",
  "payload": {
    "pickup_task_id": "f2faafa9-bca5-491f-b4b6-ef3b9884206c",
    "shipment_id": "835aa643-3538-4cb1-ae26-9beb65224618",
    "outcome": "ACCEPTED",
    "accepted_at": "2026-09-04T12:00:00.000Z",
    "assigned_driver_user_id": "driver-42",
    "acting_driver_user_id": "driver-42",
    "scanned_identifier": "WB-1001"
  },
  "metadata": {
    "replay": false
  }
}
