{
  "envelope_version": 1,
  "event_id": "b2fc03ac-4e8e-5b9d-cf3f-cdd908abf685",
  "event_type": "pickup.fact.accepted",
  "event_version": 1,
  "occurred_at": "2026-09-04T12:05:00.000Z",
  "producer": "pickup",
  "message_kind": "integration",
  "aggregate_scope": "aggregate",
  "aggregate_type": "pickup_task",
  "aggregate_id": "f2faafa9-bca5-491f-b4b6-ef3b9884206c",
  "aggregate_version": 4,
  "correlation_id": "3a7e43e5-0014-4a89-abe5-5e927cf3a3e9",
  "data_classification": "internal",
  "pii_present": false,
  "schema_uri": "https://hudhud.platform/contracts/events/pickup.fact.accepted/v1.schema.json",
  "payload": {
    "pickup_task_id": "f2faafa9-bca5-491f-b4b6-ef3b9884206c",
    "shipment_id": "835aa643-3538-4cb1-ae26-9beb65224618",
    "outcome": "ACCEPTED_WITH_EXCEPTION",
    "accepted_at": "2026-09-04T12:05:00.000Z"
  },
  "media_refs": [
    {
      "ref_type": "s3",
      "bucket": "hudhud-evidence",
      "key": "pickup-evidence/f2faafa9-bca5-491f-b4b6-ef3b9884206c/exception-note.jpg",
      "content_type": "image/jpeg"
    }
  ]
}
